Company Name,Valuation ($B),Date,Country,City,Category,investors Merged,Date Founded,Location
Farmers Business Network,1.75,8/3/2020,United States,San Carlos,Other,"Blackrock, Kleiner Perkins Caulfield & Byers, Google Ventures",,
Feedzai,1,3/24/2021,United States,San Mateo,Artificial intelligence,"Global Founders Capital, Shea Ventures, Greycroft",,
Fenbi Education,1.95,2/7/2021,China,Beijing,Edtech,"Trustbridge Partners, Hony Capital, IDG Capital",,
Fetch Rewards,1,3/31/2021,United States,Madison,E-commerce & direct-to-consumer,"Greycroft, Loeb.NYC, DST Global",,
Figma,10,4/30/2020,United States,San Francisco,Internet software & services,"Index Ventures, Greylock Partners, Kleiner Perkins Caufield & Byers",,
Figure Technologies,3.2,11/5/2019,United States,San Francisco,Fintech,"DCM Ventures, Ribbit Capital, RPM Ventures",,
Firefly Aerospace,1,5/4/2021,United States,Cedar Park,Other,"XBTO Ventures, Raven One Ventures, SK Ventures",,
FirstCry,2.1,2/7/2020,India,Pune,E-commerce & direct-to-consumer,"SoftBank Group, SAIF Partners India, Valiant Capital Partners",,
Fiture,1,4/14/2021,China,Chengdu,Health,"Bertelsmann Asia Investments, Sequoia Capital China, NIO Capital",,
Five Star Business Finance,1.4,3/26/2021,India,Chennai,Other,"Sequoia Capital India, Tiger Global Management, Tencent",,
FiveTran,1.2,6/30/2020,United States,Oakland,Data management & analytics<,"Matrix Partners, Andreessen Horowitz, General Catalyst",,
Flash Express,1,2/1/2021,Thailand,Bangkok,"Supply chain, logistics, & delivery","SCB 10X, Krungsri Finnovate, eWTP Capital",,
FlashEx,1,8/27/2018,China,Beijing,"Supply chain, logistics, & delivery","Prometheus Capital, Matrix Partners China, JD Capital Management",,
Flexport,3.2,4/30/2018,United States,San Francisco,"Supply chain, logistics, & delivery","Bloomberg Beta, Founders Fund, First Round Capital",,
Flipboard,1.32,7/22/2015,United States,Palo Alto,Internet software & services,"Kleiner Perkins Caufield & Byers, Comcast Ventures, Insight Partners",,
FlixMobility,3,7/18/2019,Germany,Munich,Auto & transportation,"Holtzbrinck Ventures, Unternehmertum Venture Capital, General Atlantic",,
Flutterwave,1,3/9/2021,United States,San Francisco,Fintech,"Green Visor Capital, CRE Venture Capital, Greycroft",,
Formlabs,2,8/1/2018,United States,Somerville,Hardware,"Pitango Venture Capital, DFJ Growth Fund, Foundry Group",,
Forte Labs,1,5/12/2021,United States,San Francisco,Fintech,"Iris Capital, Accel, Elaia Partners",,
Forter,3,11/19/2020,United States,New York,Cybersecurity,"Sequoia Capital Israel, Scale Venture Partners, Commerce Ventures",,
Forto,1.2,6/21/2021,Germany,Berlin,"Supply chain, logistics, & delivery","Cherry Ventures, Northzone Ventures, Global Founders Capital",,
Freshworks,3.5,7/31/2018,United States,San Mateo,Internet software & services,"Accel, Tiger Global Management, capitalG",,
FXiaoKe,1,7/2/2015,China,Beijing,Mobile & telecommunications,"IDG Capital, Northern Light Venture Capital, DCM Ventures",,
G2,1.1,6/22/2021,United States,Chicago,Internet software & services,"Pritzker Group Venture Capital, Accel, Hyde Park Venture Partners",,
GalaxySpace,1.22,11/17/2020,China,Beijing,Mobile & telecommunications,"Shunwei Capital Partners, 5Y Capital, Legend Capital",,
Geek+,1,11/21/2018,China,Beijing,Hardware,"Volcanics Ventures, Vertex Ventures China, Warburg Pincus",,
Getir,7.5,3/26/2021,Turkey,Istanbul,E-commerce & direct-to-consumer,"Tiger Global Management, Sequoia Capital, Revo Capital",,
Gett,1.5,5/24/2016,Israel,Tel Aviv,Auto & transportation,"Volkswagen, Access Industries, Vostok New Ventures",,
GetYourGuide,1.1,5/16/2019,Germany,Berlin,Travel,"Spark Capital, Highland Europe, Sunstone Capital",,
Ginger,1.1,3/24/2021,United States,San Francisco,Health,"Kaiser Permanente Ventures, Khosla Ventures, True Ventures",,
Ginkgo BioWorks,4.2,12/14/2017,United States,Boston,Health,"Y Combinator, Data Collective, MassVentures",,
GitLab,6,9/19/2018,United States,San Francisco,Internet software & services,"Google Ventures, ICONIQ Capital, Khosla Ventures",,
Global Switch,11.1,12/22/2016,United Kingdom,London,Hardware,"Aviation Industry Corporation of China, Essence Financial, Jiangsu Sha Steel Group",,
Globality,1,1/22/2019,United States,Menlo Park,Artificial intelligence,SoftBank Group,,
Glossier,1.2,3/19/2019,United States,New York,Consumer & retail,"Forerunner Ventures, Institutional Venture Partners, Thrive Capital",,
Glovo,1,12/19/2019,Spain,Barcelona,"Supply chain, logistics, & delivery","IDInvest Partners, Seaya Ventures, Lakestar",,
GO1,1,7/19/2021,Australia,Brisbane,Internet software & services,"Y Combinator, M12, SEEK",,
GOAT,3.7,9/23/2020,United States,Culver City,E-commerce & direct-to-consumer,"Upfront Ventures, Webb Investment Network, D1 Capital Partners",,
Gong,7.25,8/12/2020,United States,Palo Alto,Artificial intelligence,"Norwest Venture Partners, Next World Capital, Wing Venture Capital",,
GoPuff,8.9,10/8/2020,United States,Philadelphia,E-commerce & direct-to-consumer,"Accel, Softbank Group, Anthos Capital",,
Gorillas,1,3/25/2021,Germany,Berlin,E-commerce & direct-to-consumer,"Coatue Management, Atlantic Food Labs, DST Global",,
GoStudent,1.7,6/22/2021,Austria,Vienna,Edtech,"DN Capital, Left Lane Capital, Coatue Management",,
Gousto,1,11/3/2020,United Kingdom,London,"Supply chain, logistics, & delivery","MMC Ventures, BGF Ventures, Unilever Ventures",,
GPclub,1.32,10/22/2018,South Korea,Seoul,Other,Goldman Sachs,,
Grab,14.3,12/4/2014,Singapore,Singapore,Auto & transportation,"GGV Capital, Vertex Venture Holdings, Softbank Group",,
Grammarly,1,10/10/2019,United States,San Francisco,Internet software & services,"General Catalyst, Institutional Venture Partners, Breyer Capital",,
Graphcore,2.77,12/18/2018,United Kingdom,Bristol,Artificial intelligence,"Dell Technologies Capital, Pitango Venture Capital, Amadeus Capital Partners",,
Greenlight,2.3,9/24/2020,United States,Atlanta,Fintech,"Relay Ventures, TTV Capital, Canapi Ventures",,
Greensill,4,7/16/2018,United Kingdom,London,Fintech,"SoftBank Group, General Atlantic",,
Grofers,1,6/30/2021,India,Gurgaon,"Supply chain, logistics, & delivery","Tiger Global Management, Sequoia Capital India, SoftBank Group",,
Groq,1,4/14/2021,United States,Mountain View,Artificial intelligence,"TDK Ventures, Social Capital, D1 Capital Partners",,
Grove Collaborative,1.32,1/17/2018,United States,San Francisco,E-commerce & direct-to-consumer,"MHS Capital, NextView Ventures, Mayfield Fund",,
Groww,1,4/7/2021,India,Bengaluru,Fintech,"Tiger Global Management, Sequoia Capital India, Ribbit Capital",,
Guideline,1.15,6/16/2021,United States,San Mateo,Fintech,"Pelion Venture Partners, Foundation Capital, Thoma Bravo",,
Guild Education,3.75,11/13/2019,United States,Denver,Internet software & services,"General Atlantic, Blackstone, ICONIQ Growth",,
Guoquan Shihui,2,3/17/2021,China,Shanghai,Consumer & retail,"Tiantu Capital, CMB International Capital, Vision Knight Capital",,
GupShup,1.4,4/8/2021,United States,San Francisco,Internet software & services,"Helion Venture Partners, Tiger Global management, CRV",,
Gusto,3.8,12/18/2015,United States,San Francisco,Fintech,"General Catalyst Partners, Google Ventures, Kleiner Perkins Caufield & Byers",,
Gympass,2.2,6/12/2019,United States,New York,Internet software & services,"General Atlantic, SoftBank Group, Atomico",,
Gymshark,1.45,8/14/2020,United Kingdom,Solihull,E-commerce & direct-to-consumer,General Atlantic,,
Hailo,1.1,6/23/2021,Israel,Tel Aviv,Artificial intelligence,"Glory Ventures, Maniv Mobility",,
Handshake,1.5,5/12/2021,United States,San Francisco,Internet software & services,"Kleiner Perkins Caufield & Byers, Lightspeed Venture Partners, True Ventures",,
Harness,1.7,1/14/2021,United States,San Francisco,Artificial intelligence,"Menlo Ventures, Alkeon Capital Management, Citi Ventures",,
Harry's Razor Company,1.7,2/16/2018,United States,New York,Consumer & retail,"Thrive Capital, Tiger Global Management, Temasek",,
HashiCorp,5.1,11/1/2018,United States,San Francisco,Internet software & services,"Redpoint Ventures, True Ventures, Mayfield Fund",,
HeartFlow,1.3,12/4/2017,United States,Redwood City,Health,"BlueCross BlueShield Venture Partners, US Venture Partners",,
Hello TransTech,5,6/1/2018,China,Shanghai,Auto & transportation,"Ant Financial Services Group, GGV Capital",,
Hesai Tech,1.05,8/1/2020,China,Shanghai,Artificial intelligence,"Lightspeed China Partners, Baidu Ventures, Qiming Venture Partners",,
HEYTEA,9.28,7/1/2019,China,Shenzhen,Other,"Sequoia Capital China, Tencent Investment, BA Capital",,
HighRadius,3.1,1/7/2020,United States,Houston,Fintech,"Susquehanna Growth Equity, Citi Ventures, ICONIQ Capital",,
Highspot,2.3,2/22/2021,United States,Seattle,Internet software & services,"Madrona Venture Group, Shasta Ventures, Salesforce Ventures",,
Hinge Health,3,1/6/2021,United States,San Francisco,Health,"Atomico, Insight Partners, Coatue Management",,
Hippo Insurance,1.5,7/24/2019,United States,Palo Alto,Fintech,"Propel Venture Partners, Horizons Ventures, Comcast Ventures",,
Hive,2,4/21/2021,United States,San Francisco,Artificial intelligence,"Tomales Bay Capital, Bain & Company, General Catalyst",,
Hive Box,1.4,1/23/2018,China,Shenzhen,"Supply chain, logistics, & delivery","Eastern Bell Capital, SF Holding Co, STO Express",,
HMD Global,1,5/21/2018,Finland,Espoo,Mobile & telecommunications,Ginko Ventures,,
HoneyBook,1.1,5/4/2021,United States,San Francisco,Internet software & services,"Norwest Venture Partners, Hillsven Capital, Aleph",,
Hopin,5.65,11/10/2020,United Kingdom,London,Internet software & services,"Accel, Northzone Ventures, Institutional Venture Partners",,
Hopper,1,3/24/2021,Canada,Montreal,Travel,"Capital One Growth Ventures, Citi Ventures, OMERS Ventures",,
Horizon Robotics,5,2/27/2019,China,Beijing,Artificial intelligence,"Hillhouse Capital Management, Linear Venture, Morningside Venture Capital",,
Hosjoy,1,10/18/2018,China,Nanjing,E-commerce & direct-to-consumer,"U.S.-China Green Fund, Founder H Fund, Richland Equities",,
Houzz,4,9/30/2014,United States,Palo Alto,E-commerce & direct-to-consumer,"New Enterprise Associates, Sequoia Capital, Comcast Ventures",,
Howden Group Holdings,5,9/29/2020,United Kingdom,London,Other,"General Atlantic, 3i Group, Huagai Capital",,
Huaqin Telecom Technology,2.19,10/8/2019,China,Shanghai,Mobile & telecommunications,"Zhangjiang Haocheng Venture Capital, Walden International, Intel Capital",,
Huike Group,1,5/24/2018,China,Beijing,Edtech,"Fosun RZ Capital, Oceanwide Holdings, Shenzhen Qianhe Capital Management Co.",,
HuiMin,2,9/5/2016,China,Beijing,E-commerce & direct-to-consumer,"Zheshang Venture Capital, GP Capital, Western Capital Management",,
Huisuanzhang,1.28,5/24/2021,China,Beijing,Fintech,"IDG Capital, Gaocheng Capital, Chuanrong Capital",,
Huitongda,3.18,12/22/2017,China,Nanjing,E-commerce & direct-to-consumer,"Shunwei Capital Partners, Addor Capital, New Horizon Capital",,
HuJiang,1,10/29/2015,China,Shanghai,Edtech,"China Minsheng Investment, Baidu, Wanxin Media",,
HyalRoute,3.5,5/26/2020,Singapore,,Mobile & telecommunications,Kuang-Chi,,
Hyperchain,1,4/11/2021,China,Hangzhou,Fintech,"Yinhong Equity Investment Fund, E Fund, Ideal International",,
Ibotta,1,8/6/2019,United States,Denver,Fintech,"Koch Disruptive Technologies, Teamworthy Ventures, GGV Capital",,
iCarbonX,1,4/12/2016,China,Shenzhen,Artificial intelligence,"Tencent, Vcanbio",,
Icertis,2.8,7/17/2019,United States,Bellevue,Artificial intelligence,"Eight Roads Ventures, Greycroft, Ignition Partners",,
ID.me,1.5,3/19/2021,United States,McLean,Cybersecurity,"Moonshots Capital, BoxGroup, Blu Venture Investors",,
iFood,1,11/13/2018,Brazil,Osasco,"Supply chain, logistics, & delivery","Movile, Just Eat, Naspers",2011,LATAM
Illumio,2.75,4/14/2015,United States,Sunnyvale,Cybersecurity,"Data Collective, Formation 8, General Catalyst Partners",,
Iluvatar CoreX,1.55,3/1/2021,China,Shanghai,Hardware,"Centurium Capital, Cedarlake Capital, Unicom Innovation Venture Capital",,
Impact,1.5,7/13/2021,United States,Santa Barbara,Internet software & services,"Redpoint Ventures, Providence Equity Partners, Silversmith Capital Partners",,
Impossible Foods,4,5/13/2019,United States,Redwood City,Consumer & retail,"Khosla Ventures, Horizons Ventures, Temasek Holdings",,
Improbable,2,5/11/2017,United Kingdom,London,Other,"Andreessen Horowitz, SoftBank Group, Temasek Holdings",,
Inari,1.2,5/12/2021,United States,Cambridge,Other,"Flagship Pioneering, Alexandria Venture Investments, Investment Corporation of Dubai",,
Indigo Ag,3.5,9/26/2017,United States,Boston,Artificial intelligence,"Activant Capital Group, Alaska Permanent Fund, Baillie Gifford & Co.",,
Infinidat,1.6,4/29/2015,United States,Waltham,Hardware,"TPG Growth, Goldman Sachs",,
Infobip,1,7/30/2020,Croatia,Vodnjan,Mobile & telecommunications,One Equity Partners,,
Infra.Market,1,2/25/2021,India,Thane,E-commerce & direct-to-consumer,"Accel, Tiger Global Management, Nexus Venture Partners",,
Injective Protocol,1,4/20/2021,United States,New York,Fintech,"Pantera Capital, Cadenza Ventures, BlockTower Capital",,
InMobi,1,12/2/2014,India,Bengaluru,Mobile & telecommunications,"Kleiner Perkins Caufield & Byers, Softbank Corp., Sherpalo Ventures",,
Innovaccer,1.3,2/19/2021,United States,San Francisco,Health,"M12, WestBridge Capital, Lightspeed Venture Partners",,
Innovium,1,7/21/2020,United States,San Jose,Hardware,"WRVI Capital, Qualcomm Ventures, S-Cubed Capital",,
InSightec,1.3,3/6/2020,Israel,Tirat Carmel,Health,"York Capital Management, GE Healthcare, Koch Disruptive Technologies",,
Instabase,1.05,10/21/2019,United States,San Francisco,Data management & analytics,"New Enterprise Associates, Greylock Partners, Andreessen Horowitz",,
Instacart,39,12/30/2014,United States,San Francisco,"Supply chain, logistics, & delivery","Khosla Ventures, Kleiner Perkins Caufield & Byers, Collaborative Fund",,
Intarcia Therapeutics,3.8,4/1/2014,United States,Boston,Health,"New Enterprise Associates, New Leaf Venture Partners, Charter Venture Capital",,
Intellifusion,1,3/22/2019,China,Shenzhen,Artificial intelligence,"BOC International, TopoScend Capital, Hongxiu VC",,
Intercom,1.28,3/27/2018,United States,San Francisco,Internet software & services,"FirstMark Capital, Tiger Global Management",,
InVision,1.9,11/1/2017,United States,New York,Internet software & services,"FirstMark Capital, Tiger Global Management, ICONIQ Capital",,
IRL,1.17,6/15/2021,United States,San Francisco,Internet software & services,"Goodwater Capital, Floodgate, Founders Fund",,
ISN,2,12/17/2020,United States,Dallas,"Supply chain, logistics, & delivery",Blackstone,,
Iterable,2,6/15/2021,United States,San Francisco,Internet software & services,"CRV, Blue Cloud Ventures, Index Ventures",,
iTutorGroup,1,11/18/2015,China,Shanghai,Edtech,"QiMing Venture Partners, Temasek Holdings, Silverlink Capital",,
Ivalua,1.1,5/21/2019,United States,Redwood City,Fintech,"Ardian, Tiger Global Management, KKR",,
J&T Express,7.8,4/7/2021,Indonesia,Jakarta,"Supply chain, logistics, & delivery","Hillhouse Capital Management, Boyu Capital, Sequoia Capital China",,
JimuBox,1,4/21/2015,China,Beijing,Fintech,"Matrix Partners China, Ventech China, Shunwei Capital Partners",,
Jiuxian,1.05,7/30/2015,China,Beijing,E-commerce & direct-to-consumer,"Sequoia Capital China, Rich Land Capital, Merrysunny Wealth",,
JOLLY Information Technology,1.5,5/29/2018,China,Hangzhou,E-commerce & direct-to-consumer,"Legend Capital, CDH Investments, Sequoia Capital China",,
JoyTunes,1,6/21/2021,Israel,Tel Aviv,Edtech,"Genesis Partners, Aleph, Insight Partners",,
Juanpi,1.1,4/14/2016,China,Wuhan,E-commerce & direct-to-consumer,"Tiantu Capital, SAIF Partners China, Newsion Venture Capital",,
Judo Bank,1.21,12/23/2020,Australia,Melbourne,Fintech,"Ironbridge Capital, OPTrust, Myer Family Investments",,
Juma Peisong,1.45,11/26/2018,China,Chengdu,"Supply chain, logistics, & delivery","Ding Xiang Capital, New Hope Fund, Sino-Ocean Capital",,
Jusfoun Big Data,1.62,7/9/2018,China,Beijing,Data management & analytics,"Boxin Capital, DT Capital Partners, IDG Capital",,
Justworks,1.43,1/28/2020,United States,New York,Internet software & services,"Index Ventures, Thrive Capital, Bain Capital Ventures",,
JUUL Labs,12,12/20/2017,United States,San Francisco,Consumer & retail,Tiger Global Management,,
K Health,1.5,1/19/2021,United States,New York,Health,"Max Ventures, Mangrove Capital Partners, 14W",,
Kajabi,2,5/4/2021,United States,Irvine,Internet software & services,"Meritech Capital Partners, Tiger Global Management, Spectrum Equity",,
Kaseya,2,3/27/2019,United States,Miami,Cybersecurity,"Insight Partners, TPG Alternative & Renewable Technologies, Ireland Strategic Investment Fund",,
Kavak,4,10/1/2020,Mexico,Lerma de Villada,E-commerce & direct-to-consumer,"DST Global, SoftBank Group, Mountain Nazca",2016,LATAM
Keep,2,5/19/2020,China,Beijing,Mobile & telecommunications,"Bertelsmann Asia Investments, GGV Capital, Morningside Venture Capital",,
KeepTruckin,2.3,4/23/2019,United States,San Francisco,"Supply chain, logistics, & delivery","Google Ventures, Index Ventures, Scale Venture Partners",,
Kendra Scott,1,12/21/2016,United States,Austin,Consumer & retail,"Berkshire Partners, Norwest Venture Partners",,
Kitopi,1,7/1/2021,United Arab Emirates,Dubai,"Supply chain, logistics, & delivery","CE-Ventures, BECO Capital, Nordstar",,
KK Group,3,10/23/2019,China,Dongguan,E-commerce & direct-to-consumer,"Matrix Partners China, Bright Venture Capita, Shenzhen Capital Group",,
KKW Beauty,1,6/29/2020,United States,Woodland Hills,E-commerce & direct-to-consumer,Coty,,
Klarna,45.6,12/12/2011,Sweden,Stockholm,Fintech,"Institutional Venture Partners, Sequoia Capital, General Atlantic",,
Klaviyo,9.2,11/17/2020,United States,Boston,Internet software & services,"Summit Partners, Accel, Astral Capital",,
Klook,1.35,8/7/2018,Hong Kong,Central,Travel,"Sequoia Capital China, Goldman Sachs, Matrix Partners China",,
KnowBox,1,5/30/2019,China,Beijing,Edtech,"TAL Education Group, Legend Star, Alibaba Group",,
Komodo Health,3.3,3/22/2021,United States,San Francisco,Health,"Andreessen Horowitz, IA Ventures, Felicis Ventures",,
Kong,1.4,12/31/2020,United States,San Francisco,Internet software & services,"New Enterprise Associates, CRV, Index Ventures",,
Koudai,1.4,10/23/2014,China,Beijing,E-commerce & direct-to-consumer,"New Enterprise Associates, Tiger Global management, Tencent",,
Krafton Game Union,5,8/9/2018,South Korea,Seongnam,Other,"Tencent Holdings, Stonebridge Capital, IMM Investment",,
Kraken,2.92,6/25/2019,United States,San Francisco,Fintech,"Bnk To The Future, Trammell Ventures, SBI Investment",,
KRY,2,4/27/2021,Sweden,Stockholm,Health,"Index Ventures, Creandum, Accel",,
Kuaigou Dache,1,7/13/2018,China,Tianjin,"Supply chain, logistics, & delivery","Sequoia Capital China, InnoVision Capital, Qianhai Fund of Funds",,
Kuaikan Manhua,2,12/1/2017,China,Beijing,Internet software & services,"Sequoia Capital China, CMC Capital Partners, Tencent Holdings",,
Kujiale,2,10/25/2019,China,Hangzhou,Internet software & services,"GGV Capital, IDG Capital, Linear Venture",,
Kurly,2.2,7/9/2021,South Korea,Seoul,"Supply chain, logistics, & delivery","Sequoia Capital China, DST Global, DST Global",,
L&P Cosmetic,1.19,1/1/2016,South Korea,Seoul,Consumer & retail,CDIB Capital,,
Lacework,1,1/7/2021,United States,San Jose,Cybersecurity,"Sutter Hill Ventures, Liberty Global Ventures, Coatue Management",,
Lalamove,10,2/21/2019,Hong Kong,Cheung Sha Wan,"Supply chain, logistics, & delivery","MindWorks Ventures, Shunwei Capital Partners, Xiang He Capital",,
Lamabang,1,3/6/2015,China,Shenzhen,E-commerce & direct-to-consumer,"5Y Capital, Matrix Partners China, K2VC",,
Lattice,1,3/23/2021,United States,San Francisco,Internet software & services,"Khosla Ventures, Thrive Capital, Y Combinator",,
Leap Motor,1.01,11/20/2018,China,Hangzhou,Auto & transportation,"Sequoia Capital China, Gopher Asset Management, Shanghai Electric Group",,
Ledger,1.5,6/10/2021,France,Paris,Hardware,"Digital Currency Group, Draper Esprit, Korelya Capital",,
Lenskart,2.5,12/20/2019,India,Faridabad,E-commerce & direct-to-consumer,"Chiratae Ventures, PremjiInvest, Softbank",,
LetsGetChecked,1,6/7/2021,Ireland,Dublin,Health,"Optum Ventures, Qiming Venture Partners, Transformation Capital",,
Lianjia,5.77,4/7/2016,China,Beijing,E-commerce & direct-to-consumer,"Tencent, Baidu, Huasheng Capital",,
LifeMiles,1.15,7/13/2015,Colombia,Bogota,Other,Advent International,2013,LATAM
Lightricks,1,7/31/2019,Israel,Jerusalem,Artificial intelligence,"Viola Ventures, Insight Partners, ClalTech, Goldman Sachs",,
Lilium Aviation,1,6/9/2020,Germany,Wessling,Other,"Freigeist Capital, Obvious Ventures, Atomico",,
LinkDoc Technology,1,7/5/2018,China,Beijing,Health,"China Investment Corporation, New Enterprise Associates",,
LinkSure Network,1,1/1/2015,China,Shanghai,Mobile & telecommunications,N/A,,
Liquid,1,4/3/2019,Japan,Tokyo,Fintech,"JAFCO Co, Bitmain Technologies, IDG Capital",,
Locus Robotics,1,2/17/2021,United States,Wilmington,Hardware,"Scale Venture Partners, Bond, Tiger Global Management",,
Loft,2.9,1/3/2020,Brazil,Sao Paulo,E-commerce & direct-to-consumer,"Monashees+, Andreessen Horowitz, QED Investors",2018,LATAM
Loggi,2,6/5/2019,Brazil,Sao Paulo,"Supply chain, logistics, & delivery","Qualcomm Ventures, SoftBank Group. Monashees+",2013,LATAM
Lookout,1,10/10/2013,United States,San Francisco,Cybersecurity,"Accel Partners, Greylock Partners, Lowercase Capital",,
Loom,1.53,5/20/2021,United States,San Francisco,Internet software & services,"Kleiner Perkins Caufield & Byers, Sequoia Capital, General Catalyst",,
Lucid Software,3,6/29/2021,United States,South Jordan,Internet software & services,"Spectrum Equity, ICONIQ Capital, Grayhawk Capital",,
Lunar,1,7/12/2021,Denmark,Aarhus,Fintech,"SEED Capital, Greyhound Capital, Socii Capital",,
Luoji Siwei,1.18,7/20/2017,China,Beijing,Edtech,"Sequoia Capital China, Qiming Venture Partners, Tencent Holdings",,
Lyra Health,4.6,8/25/2020,United States,Burlingame,Health,"Greylock Partners, Venrock, Providence Ventures",,
M1 Finance,1.45,7/14/2021,United States,Chicago,Fintech,"Left Lane Capital, Clocktower Technology Ventures, Jump Capital",,
MadeiraMadeira,1,1/7/2021,Brazil,Parana,E-commerce & direct-to-consumer,"Flybridge Capital Partners, SoftBank Group, Monashees+",2009,LATAM
Mafengwo,2,5/23/2019,China,Beijing,Travel,"Qiming Venture Partners, Capital Today, General Atlantic",,
Magic Leap,4.82,10/21/2014,United States,Plantation,Hardware,"Obvious Ventures, Qualcomm Ventures, Andreessen Horowitz",,
Maimai,1,11/15/2017,China,Beijing,Mobile & telecommunications,"Morningside Venture Capital, IDG Capital, DCM Ventures",,
Mambu,2.08,1/6/2021,Germany,Berlin,Fintech,"Runa Capital, Acton Capital Partners, Point Nine Capital",,
Manner,1.3,12/24/2020,China,Shanghai,Other,"Coatue Management, H Capital, Capital Today",,
ManoMano,2.6,7/5/2021,France,Paris,E-commerce & direct-to-consumer,"General Atlantic, Piton Capital, Partech Partners",,
MasterClass,2.75,5/13/2021,United States,San Francisco,Edtech,"Institutional Venture Partners, New Enterprise Associates, Javelin Venture Partners",,
MediaMath,1,7/10/2018,United States,New York,Internet software & services,"Silicon Valley Bank, QED Investors, European Founders Fund",,
Medlinker,1,7/31/2018,China,Chengdu,Health,"China Health Industry Investment Fund, China Renaissance, and Sequoia Capital China",,
Meero,1,6/18/2019,France,Paris,Artificial intelligence,"Aglae Ventures, Global Founders Capital, Alven Capital",,
Meesho,2.1,4/5/2021,India,Bengaluru,Internet software & services,"Venture Highway, Sequoia Capital India, Prosus Ventures",,
MEGVII,4,10/31/2017,China,Beijing,Artificial intelligence,"Ant Financial Services Group, Russia-China Investment Fund, Foxconn Technology Company",,
Meicai,2.8,6/22/2016,China,Beijing,Mobile & telecommunications,"Tiger Global Management, Blue Lake Capital, ZhenFund",,
Meizu Technology,4.58,7/23/2014,China,Zhuhai,Hardware,"Telling Telecommunication Holding Co., Alibaba Group",,
Melio,1.34,1/25/2021,Israel,Tel Aviv,Fintech,"Accel, Aleph, American Express Ventures",,
Mercury,1.6,7/3/2021,United States,San Francisco,Fintech,"Andreessen Horowitz, Coatue Management, Clocktower Technology Ventures",,
MessageBird,3.8,10/8/2020,Netherlands,Amsterdam,Mobile & telecommunications,"Y Combinator, Atomico, Accel",,
Mia.com,1,9/8/2015,China,Beijing,E-commerce & direct-to-consumer,"Sequoia Capital China, ZhenFund, K2 Ventures",,
Miaoshou Doctor,1,6/27/2019,China,Beijing,E-commerce & direct-to-consumer,"Sequoia Capital China, Qiming Venture Partners, Tencent Holdings",,
MindMaze,1,1/28/2016,Switzerland,Lausanne,Health,Hinduja Group,,
Mininglamp Technology,1.19,3/27/2019,China,Beijing,Artificial intelligence,"Russia-China Investment Fund, Tencent Holdings, Sequoia Capital China",,
Mirakl,1.5,9/22/2020,France,Paris,E-commerce & direct-to-consumer,"Elaia Partners, 83North, Felix Capital",,
Misfits Market,1.1,4/21/2021,United States,Pennsauken,E-commerce & direct-to-consumer,"Accel, D1 Capita Partners, Greenoaks Capital Management",,
MobileCoin,1,7/7/2021,United States,San Francisco,Fintech,"General Catalyst, Future Ventures, AU21",,
Mobvoi,1,4/6/2017,China,Beijing,Consumer & retail,"Sequoia Capital China, SIG Asia Investments, ZhenFund",,
Modern Health,1.17,2/11/2021,United States,San Francisco,Health,"Kleiner Perkins Caufield & Byers, Afore Capital, Founders Fund",,
Modernizing Medicine,1,5/10/2017,United States,Boca Raton,Health,"Warburg Pincus, Summit Partners, Sands Capital",,
Mofang Living,1.5,4/13/2016,China,Shanghai,E-commerce & direct-to-consumer,"Warburg Pincus, Aviation Industry Corporation of China",,
