Company Name,Valuation ($B),Date,Country,City,Category,investors Merged,Date Founded,Location
ThoughtSpot,2.05,5/8/2018,United States,Sunnyvale,Internet software & services,"Lightspeed Venture Partners, Khosla Ventures, Geodesic Capital",,
Thrasio,6,7/15/2020,United States,Walpole,Other,"Upper90, RiverPark Ventures, Advent International",,
Thumbtack,3.2,9/29/2015,United States,San Francisco,E-commerce & direct-to-consumer,"Tiger Global, Sequoia Capital, Google Capital",,
Tipalti,2,10/6/2020,United States,San Mateo,Fintech,"01 Advisors, Zeev Ventures, Group 11",,
Toast,4.9,7/10/2018,United States,Boston,Fintech,"Bessemer Venture Partners, Tiger Global Management, Google Ventures",,
Tonal,1.6,3/31/2021,United States,San Francisco,E-commerce & direct-to-consumer,"Mayfield Fund, Shasta Ventures, L Catterton",,
Tongdun Technology,1.32,4/25/2019,China,Hangzhou,Cybersecurity,"Advantech Capital, Temasek Holdings Ltd., Tiantu Capital Co.",,
Toss,7.4,12/9/2018,South Korea,Seoul,Fintech,"Bessemer Venture Partners, Qualcomm Ventures, Kleiner Perkins Caufield & Byers",,
Tractable,1,6/16/2021,United Kingdom,London,Artificial intelligence,"Insight Partners, Ignition Partners, Georgian Partners",,
Trade Republic,5.3,5/20/2021,Germany,Berlin,Fintech,"Founders Fund. Accel, Creandum",,
Trader Interactive,1.63,5/12/2021,United States,Norfolk,Other,Carsales,,
Tradeshift,2.7,5/30/2018,United States,San Francisco,Fintech,"Notion Capital, Scentan Ventures, Kite Ventures",,
Transmit Security,2.74,6/22/2021,Israel,Tel Aviv,Cybersecurity,"General Atlantic, Insight Partners, Vintage Investment Partners",,
Traveloka,3,1/1/2017,Indonesia,Jakarta,Travel,"Global Founders Capital, East Ventures, Expedia Inc.",,
Trax,1.3,7/22/2019,Singapore,,Artificial intelligence,"Hopu Investment Management, Boyu Capital, DC Thomson Ventures",,
Trendy Group International,2,2/13/2012,Hong Kong,Kowloon,Consumer & retail,L Capital Partners,,
Tresata,1,10/10/2018,United States,Charlotte,Fintech,GCP Capital Partners,,
TripActions,5,11/8/2018,United States,Palo Alto,Travel,"Andreessen Horowitz, Lightspeed Venture Partners, Zeev Ventures",,
Trulioo,1.75,6/7/2021,Canada,Vancouver,Cybersecurity,"Blumberg Capital, American Express Ventures, BDC Venture Capital",,
Trumid,1,7/15/2020,United States,New York,Fintech,"T. Rowe Price, Dragoneer Investment Group, BlackRock",,
Tubatu.com,2,3/9/2015,China,Shenzhen,E-commerce & direct-to-consumer,"Sequoia Capital China, Matrix Partners China, 58.com",,
Tuhu,1.16,9/15/2018,China,Shanghai,Auto & transportation,"Qiming Venture Partners, Yaxia Automobile, Far East Horizon",,
TuJia,1.5,6/17/2015,China,Beijing,Travel,"GGV Capital, QiMing Venture Partnersl",,
UBTECH Robotics,4.45,7/25/2016,China,Shenzhen,Hardware,"CDH Investments, Goldstone Investments, Qiming Venture Partners",,
Udaan,3.1,9/4/2018,India,Bengaluru,"Supply chain, logistics, & delivery","DST Global, Lightspeed Venture Partners, Microsoft ScaleUp",,
Udemy,3.2,2/19/2020,United States,San Francisco,Edtech,"MHS Capital, Insight Partners, Norwest Venture Partners",,
UISEE Technology,1.08,1/25/2021,China,Beijing,"Supply chain, logistics, & delivery","Shenzhen Capital Group, Robert Bosch Venture Capital, SeptWolves Ventures",,
Unacademy,2,9/2/2020,India,Bengaluru,Edtech,"Blume Ventures, Nexus Venture Partners, Sequoia Capital India",,
Unisound,1.19,7/19/2018,China,Beijing,Artificial intelligence,"Qiming Venture Partners, China Internet Investment Fund, Qualcomm Ventures",,
Unite Us,1.7,3/17/2021,United States,New York,Health,"Insight Partners, Sequoia Capital, Index Ventures",,
United Imaging Healthcare,5,9/15/2017,China,Shanghai,Health,"China Life Insurance, China Development Bank Capital, CITIC Securities International",,
Unqork,2,10/6/2020,United States,New York,Fintech,"Blackrock, capitalG, World Lab Innovation",,
Upgrade,1,2/12/2018,United States,San Francisco,Fintech,"Union Square Ventures, Ribbit Capital, VY Capital",,
Uplight,1.5,3/3/2021,United States,Boulder,Other,"Rubicon Technology Partners, Max Ventures, Inclusive Capital Partners",,
Uptake,2.3,10/27/2015,United States,Chicago,Artificial intelligence,"Revolution, New Enterprise Associates, Caterpillar",,
Urban Company,2.1,4/27/2021,India,Gurgaon,E-commerce & direct-to-consumer,"VY Capital, Accel, Elevation Capital",,
Vacasa,1,10/29/2019,United States,Portland,Travel,"Level Equity, NewSpring Holdings, Riverwood Capital",,
VANCL,3,12/14/2010,China,Beijing,E-commerce & direct-to-consumer,"Ceyuan Ventures, QiMing Venture Partners, Temasek Holdings",,
VAST Data,3.7,4/16/2020,United States,New York,Data management & analytics,"Norwest Venture Partners, Goldman Sachs, Dell Technologies Capital",,
Vectra Networks,1.2,4/29/2021,United States,San Jose,Artificial intelligence,"IA Ventures, Khosla Ventures, AME Cloud Ventures",,
Veepee,1.38,7/20/2007,France,La Plaine Saint-Denis,E-commerce & direct-to-consumer,"Summit Partners, Qatar Holding",,
Venafi,1.15,12/10/2020,United States,Salt Lake City,Cybersecurity,"Pelion Venture Partners, Foundation Capital, Thoma Bravo",,
VerbIT,1,6/8/2021,Israel,Tel Aviv,Artificial intelligence,"ClalTech, Vertex Ventures, Oryzn Capital",,
Verkada,1.6,1/29/2020,United States,San Mateo,Cybersecurity,"next47, First Round Capital, Sequoia Capital",,
Vestiaire Collective,1,3/1/2021,France,Paris,E-commerce & direct-to-consumer,"Eurazeo, IDInvest Partners, Balderton Capital",,
Via,2.25,3/30/2020,United States,New York,Auto & transportation,"83North, RiverPark Ventures, Pitango Venture Capital",,
Vice Media,5.7,4/2/2011,United States,Brooklyn,Internet software & services,"Technology Crossover Ventures, A&E Television Networks",,
VillageMD,1,7/8/2020,United States,Chicago,Health,"Kinnevik, Oak HC/FT Partners, Walgreens Boots Alliance",,
Vinted,4.53,11/27/2019,Lithuania,Vilnius,E-commerce & direct-to-consumer,"Accel, Insight Partners, Burda Principal Investments",,
VIPKid,4.5,8/4/2016,China,Beijing,Edtech,"Sequoia Capital China, Tencent Holdings, Sinovation Ventures",,
Virta Health,2,12/2/2020,United States,San Francisco,Health,"Caffeinated Capital, Obvious Ventures, Venrock",,
Vise,1,5/18/2021,United States,New York,Fintech,"Sequoia Capital, Founders Fund, Bling Capital",,
Visier,1,6/29/2021,Canada,Vancouver,Internet software & services,"Foundation Capital, Summit Partners, Adams Street Partners",,
Vista Global,2.5,8/23/2017,United Arab Emirates,Dubai,Other,Rhone Capital,,
Voodoo,1.4,8/17/2020,France,Paris,Other,"Tencent Holdings, Goldman Sachs",,
Vox Media,1,8/12/2015,United States,Washington,Internet software & services,"Accel Partners, Comcast Ventures, General Atlantic",,
VTEX,1.7,9/28/2020,Brazil,Sao Paulo,E-commerce & direct-to-consumer,"Riverwood Capital, Gavea Investimentos, Endeavor",2000,LATAM
VTS,1,5/7/2019,United States,New York,Internet software & services,"Trinity Ventures, Fifth Wall Ventures, OpenView Venture Partners",,
Wacai,1,7/18/2018,China,Hangzhou,Mobile & telecommunications,"Qiming Venture Partners, China Broadband Capital, CDH Investments",,
Warby Parker,3,4/30/2015,United States,New York,E-commerce & direct-to-consumer,"BoxGroup, Felicis Ventures, First Round Capital",,
We Doctor,7,9/22/2015,China,Hangzhou,Health,"Tencent, Morningside Group",,
Webflow,2.1,1/13/2021,United States,San Francisco,Internet software & services,"Accel, Silversmith Capital Partners, capitalG",,
WeBull,1,2/18/2021,China,Changsha,Fintech,"Bojiang Capital, Hongdao Capital, Mobai Capital",,
Weee!,2.8,3/16/2021,United States,Fremont,"Supply chain, logistics, & delivery","Goodwater Capital, iFly, XVC Venture Capital",,
wefox,1.65,3/5/2019,Germany,Berlin,Fintech,"Salesforce Ventures, Seedcamp, OMERS Ventures",,
Weilong,10.88,5/8/2021,China,Luohe,Consumer & retail,"Tencent Holdings, Hillhouse Capital Management, Yunfeng Capital",,
WeLab,1,11/8/2017,Hong Kong,,Fintech,"Sequoia Capital China, ING, Alibaba Entrepreneurs Fund",,
WEMAKEPRICE,2.34,9/9/2015,South Korea,Seoul,E-commerce & direct-to-consumer,"IMM Investment, NXC",,
WeRide,3.3,12/23/2020,China,Guangzhou,Auto & transportation,"Atop Capital, IDInvest Partners, Qiming Venture Partners",,
Whoop,1.2,10/28/2020,United States,Boston,E-commerce & direct-to-consumer,"NextView Ventures, Promus Ventures, Two Sigma Ventures",,
Wildlife Studios,3,12/5/2019,Brazil,Sao Paulo,Other,"Benchmark, Bessemer Venture Partners",2011,LATAM
Wiz,1.7,3/17/2021,Israel,Tel Aviv,Cybersecurity,"Insight Partners, Sequoia Capital, Index Ventures",,
WM Motor,5,3/8/2019,China,Shanghai,Auto & transportation,"Baidu Capital, Linear Venture, Tencent",,
Womai,1,10/12/2015,China,Beijing,E-commerce & direct-to-consumer,"SAIF Partners China, Baidu, IDG Capital",,
Workato,1.7,1/12/2021,United States,Mountain View,Internet software & services,"Battery Ventures, Storm Ventures, Redpoint Ventures",,
Workhuman,1.2,6/23/2020,Ireland,Dublin,Internet software & services,ICG,,
Workrise,2.9,9/30/2019,United States,Austin,Internet software & services,"Founders Fund, Quantum Energy Partners, Bedrock Capital",,
WTOIP,1.27,4/8/2018,China,Guangzhou,Internet software & services,"Dark Horse Technology Group, Hopu Investment Management, Kefa Capital",,
XANT,1.65,4/28/2014,United States,Lehi,Artificial intelligence,"Microsoft Ventures, US Venture Partners, Kleiner Perkins Caufield & Byers",,
XForcePlus,1,5/1/2021,China,Shanghai,Internet software & services,"Eastern Bell Capital, Danhua Capital, MSA Capital",,
Xiaobing,1,7/12/2021,China,Beijing,Fintech,"NetEase Capital, Northern Light Venture Capital, Microsoft",,
Xiaohongshu,3,3/31/2016,China,Shanghai,E-commerce & direct-to-consumer,"GGV Capital, ZhenFund, Tencent",,
XiaoZhu,1.5,11/1/2017,China,Beijing,Travel,"Morningside Ventures, Capital Today, JOY Capital",,
Ximalaya FM,1.52,9/22/2017,China,Shanghai,Mobile & telecommunications,"China Creation Ventures, Sierra Ventures, Xingwang Investment Management",,
Xinchao Media,2.59,4/9/2018,China,Chengdu,Internet software & services,"JD.com, Baidu, Vision Plus Capital",,
Xingsheng Selected,8,7/22/2020,China,Changsha,E-commerce & direct-to-consumer,"KKR, Tencent Holdings, Sequoia Capital China",,
Xingyun B2B,2,9/24/2020,China,Shenzhen,E-commerce & direct-to-consumer,"Matrix Partners China, Eastern Bell Capital, Hongtai Capital Holdings",,
Yanolja,1,6/10/2019,South Korea,Seoul,Travel,"SBI Investment Korea, Partners Investment, GIC",,
Yaoshibang,1.35,6/15/2021,China,Guangzhou,Health,"Green Pine Capital Partners, Ivy Capital, DCM Ventures",,
Yello Mobile,4,11/11/2014,South Korea,Seoul,Mobile & telecommunications,Formation 8,,
YH Global,1,9/21/2017,China,Shenzhen,"Supply chain, logistics, & delivery","Co-Energy Finance, Grandland",,
Yidian Zixun,1.4,10/17/2017,China,Beijing,Mobile & telecommunications,"Phoenix New Media, Tianjin Haihe Industry Fund",,
Yiguo,1.2,11/9/2016,China,Shanghai,"Supply chain, logistics, & delivery","Alibaba Group, KKR, Goldman Sachs",,
Yijiupi,1.5,9/20/2018,China,Beijing,Consumer & retail,"Source Code Capital, Meituan Dianping, Tencent Holdings",,
Yimidida,1.17,1/14/2019,China,Shanghai,"Supply chain, logistics, & delivery","Source Code Capital, Global Logistic Properties, K2VC",,
Yipin Shengxian,1.49,3/11/2019,China,Hefei,E-commerce & direct-to-consumer,"Eastern Bell Capital, Capital Today, Longzhu Capital",,
YITU Technology,2.17,3/8/2018,China,Shanghai,Artificial intelligence,"Sequoia Capital China, Banyan Capital",,
Yixia,3,11/24/2015,China,Beijing,Mobile & telecommunications,"Sequoia Capital China, Sina Weibo, Kleiner Perkins Caufield & Byers, Redpoint Ventures",,
Ynsect,1,2/21/2019,France,Evry,Other,"Astanor Ventures, Upfront Ventures, IDInvest Partners",,
Yotpo,1.4,3/18/2021,United States,New York,Internet software & services,"Bessemer Venture Partners, Vintage Investment Partners, Blumberg Capital",,
You & Mr Jones,1.3,11/19/2019,United States,New York,Other,Undisclosed,,
Youxia Motors,3.35,4/2/2018,China,Shanghai,Auto & transportation,"China Environmental Protection Industry, China Fortune Ocean",,
Yuanfudao,15.5,5/31/2017,China,Beijing,Edtech,"Tencent Holdings, Warbug Pincus, IDG Capital",,
Yuanqi Senlin,6,3/1/2020,China,Beijing,Consumer & retail,"Sequoia Capital China, Longfor Capitalm, Gaorong Capital",,
YunQuNa,1.5,6/29/2021,China,Shanghai,"Supply chain, logistics, & delivery","Source Code Capital, Coatue Management, DCM Ventures",,
Yunxuetang,1,3/29/2021,China,Suzhou,Edtech,"Matrix Partners China, Sequoia Capital China, Hundreds Capital",,
Zapier,4,1/14/2021,United States,Sunnyvale,Internet software & services,"Sequoia Capital, Bessemer Venture Partners, Threshold Ventures",,
Zego,1.1,3/9/2021,United Kingdom,London,Fintech,"LocalGlobe, Balderton Capital, Target Global",,
Zenefits,4.5,5/6/2015,United States,San Francisco,Fintech,"SV Angel, Institutional Venture Partners, Venrock",,
Zenoti,1.5,12/15/2020,United States,Bellevue,Internet software & services,"Norwest Venture Partners, Accel, Tiger Global Management",,
Zeta,1.45,5/24/2021,United States,San Francisco,Fintech,"Sodexo Ventures, SoftBank Group",,
Zhaogang,1,6/29/2017,China,Shanghai,E-commerce & direct-to-consumer,"K2 Ventures, Matrix Partners China, IDG Capital",,
Zhuan Zhuan,1,4/18/2017,China,Beijing,E-commerce & direct-to-consumer,"58.com, Tencent Holdings",,
Zhubajie,1.61,6/16/2015,China,Chongqing,Internet software & services,"Cybernaut Growth Fund, IDG Capital",,
Zipline,2.8,5/20/2019,United States,South San Francisco,"Supply chain, logistics, & delivery","Sequoia Capital, Baillie Gifford & Co., Google Ventures",,
Ziroom,6.6,1/17/2018,China,Beijing,E-commerce & direct-to-consumer,"Sequoia Capital China, Warburg Pincus, General Catalyst",,
ZocDoc,1.8,8/20/2015,United States,New York,Health,"Founders Fund, Khosla Ventures, Goldman Sachs",,
ZongMu Technology,11.4,6/3/2021,China,Shanghai,Auto & transportation,"LTW Capital, Legend Capital, Qualcomm Ventures",,
Zume,2.25,11/1/2018,United States,Mountain View,Consumer & retail,"Softbank Group, AME Cloud Ventures, SignalFire",,
Zuoyebang,3,7/18/2018,China,Beijing,Edtech,"Sequoia Capital China, Xiang He Capital, GGV Capital",,
Zwift,1,9/16/2020,United States,Long Beach,E-commerce & direct-to-consumer,"Novator Partners, True, Causeway Media Partners",,
