Company Name,Valuation ($B),Date,Country,City,Category,investors Merged,Date Founded,Location
4Paradigm,2,12/19/2018,China,Beijing,Artificial intelligence,"Sequoia Capital China, China Construction Bank, Bank of China",,
56PINGTAI,1.08,1/25/2021,China,Shanghai,"Supply chain, logistics, & delivery","QF Capital, QC Capital, Unicom Innovation Venture Capital",,
58 Daojia,1,10/12/2015,China,Beijing,Internet software & services,"KKR, Alibaba Group, Ping An Insurance",,
6Sense,2.1,3/30/2021,United States,San Francisco,Artificial intelligence,"Venrock, Battery Ventures, Insight Partners",,
ABL Space Systems,1.3,3/25/2021,United States,El Segundo,Other,"T. Rowe Price, Lockheed Martin Ventures, Fidelity Investment",,
Acronis,2.5,9/18/2019,Switzerland,Schaffhausen,Cybersecurity,"Goldman Sachs, VebVentures, Insight Partners",,
ActiveCampaign,3,4/21/2021,United States,Chicago,Internet software & services,"Silversmith Capital Partners, Susquehanna Growth Equity, Tiger Global Management",,
Ada Support,1.2,5/7/2021,Canada,Toronto,Artificial intelligence,"Version One Ventures, Bessemer Venture Partners, FirstMark Capital",,
Addepar,2.17,6/15/2021,United States,Mountain View,Fintech,"8VC, D1 Capital Partners, Sway Ventures",,
Afiniti,1.6,4/14/2017,Bermuda,Hamilton,Artificial intelligence,GAM Holding,,
Age of Learning,3,5/3/2016,United States,Glendale,Edtech,Iconiq Capital,,
Aibee,1.2,4/13/2021,China,Beijing,Artificial intelligence,"Sequoia Capital China, Lenovo Capital and Incubator, Group GSR Ventures",,
AInnovation,1,12/16/2020,China,Beijing,Artificial intelligence,"CICC ALPHA, Chengwei Capital, Sinovation Ventures",,
Aircall,1,6/23/2021,United States,New York,Internet software & services,"Balderton Capital, Next World Capital, Draper Esprit",,
Airtable,5.77,11/15/2018,United States,San Francisco,Internet software & services,"Caffeinated Capital, CRV, Founder Collective",,
Airwallex,2.6,3/25/2019,Australia,Melbourne,Fintech,"DST Global, Sequoia Capital China, Tencent Holdings",,
AIWAYS,1.78,4/16/2018,China,Shanghai,Auto & transportation,"Jiangsu Sha Steel Group, Shanghai Puyin Industry, Funa Yuanchuang Technology",,
Alan,1.68,4/19/2021,France,Paris,Fintech,"Index Ventures, Temasek, Portag3 Ventures",,
Alation,1.2,6/3/2021,United States,Redwood City,Internet software & services,"Costanoa Ventures, Data Collective, Salesforce Ventures",,
Aledade,1.9,1/19/2021,United States,Bethesda,Health,"Venrock, CVF Capital Partners, ARCH Venture Partners",,
Allbirds,1.7,10/11/2018,United States,San Francisco,E-commerce & direct-to-consumer,"Lerer Hippeau Ventures, T. Rowe Price, Tiger Global Management",,
Alto Pharmacy,1,1/30/2020,United States,San Francisco,Health,"Jackson Square Ventures, Greenoaks Capital Management, Softbank Group",,
Alzheon,1.31,9/30/2020,United States,Framingham,Health,"ARCH Venture Partners, Ally Bridge Group",,
Amber Group,1.1,6/21/2021,Hong Kong,,Fintech,"Tiger Global Management, Tiger Brokers, DCM Ventures",,
Amount,1,5/17/2021,United States,Chicago,Fintech,"Invus Group, Hanaco Venture Capital, WestCap Group",,
Amperity,1,7/13/2021,United States,Seattle,Artificial intelligence,"Madrona Venture Group, Tiger Global Management, Madera Technology Partners",,
Amplitude,4.15,5/21/2020,United States,San Francisco,Data management & analytics,"Benchmark, Battery Ventures, Institutional Venture Partners",,
Anduril,4.6,9/11/2019,United States,Irvine,Artificial intelligence,"Andreessen Horowitz, Founders Fund, Revolution Ventures",,
Apeel Sciences,1,5/26/2020,United States,Goleta,Other,"Upfront Ventures, Tao Capital Partners, Andreessen Horowitz",,
AppDirect,1.1,10/7/2015,United States,San Francisco,E-commerce & direct-to-consumer,"Mithril, iNovia Capital, Foundry Group",,
Applied Intuition,1.25,10/22/2020,United States,Sunnyvale,Data management & analytics,"Andreessen Horowitz, Lux Capital, General Catalyst",,
ApplyBoard,3,5/5/2020,Canada,Kitchener,Edtech,"Artiman Ventures, Plug and Play Ventures, Anthos Capital",,
AppsFlyer,2,1/21/2020,United States,San Francisco,Mobile & telecommunications,"Magma Venture Partners, Pitango Venture Capital, Qumra Capital",,
Aprogen,1.04,5/31/2019,South Korea,Seongnam-Si,Health,"Lindeman Asia Investment, Nichi-Iko Pharmaceutical",,
Apus Group,1.73,1/16/2015,China,Beijing,Mobile & telecommunications,"Redpoint Ventures, QiMing Venture Partners, Chengwei Capital",,
Aqua Security,1,3/10/2021,Israel,Ramat Gan,Cybersecurity,"TLV Partners, Lightspeed Venture Partners, M12",,
Arctic Wolf Networks,4.3,10/22/2020,United States,Eden Prairie,Cybersecurity,"Lightspeed Venture Partners, Redpoint Ventures, Viking Global Investors",,
Argo AI,7.25,7/12/2019,United States,Pittsburgh,Artificial intelligence,"Volkswagen Group, Ford Autonomous Vehicles",,
Arrail Dental,2,4/13/2021,China,Beijing,Health,"Qiming Venture Partners, Kleiner Perkins Caufield & Byers, OrbiMed Advisors",,
Articulate,3.75,7/1/2021,United States,New York,Edtech,"Redpoint Ventures, Harrison Metal, Bessemer Venture Partners",,
ASAPP,1.6,5/19/2021,United States,New York,Artificial intelligence,"March Capital Partners, HOF Capital, Emergence Capital Partners",,
ASR Microelectronics,1.6,4/30/2020,China,Shanghai,Hardware,"Shenzhen Capital Group, Sequoia Capital China, Hillhouse Capital Management",,
Astranis Space Technologies,1.4,4/14/2021,United States,San Francisco,Mobile & telecommunications,"Refactor Capital, Andreessen Horowitz, Fifty Years Fund",,
Attentive,2.2,9/23/2020,United States,Hoboken,Mobile & telecommunications,"NextView Ventures, Eniac Ventures, Sequoia Capital",,
Aura,1,6/9/2021,United States,Burlington,Cybersecurity,"Warburg Pincus, General Catalyst",,
Aurora,10,2/7/2019,United States,Mountain View,Auto & transportation,"Index Ventures, Greylock Partners, Lightspeed Venture Partners",,
Automation Anywhere,6.8,7/2/2018,United States,San Jose,Artificial intelligence,"General Atlantic, Goldman Sachs, New Enterprise Associates",,
Automattic,1.8,5/27/2013,United States,San Francisco,Internet software & services,"Insight Venture Partners, Lowercase Capital, Polaris Partners",,
Avant,2,12/17/2012,United States,Chicago,Artificial intelligence,"RRE Ventures, Tiger Global, August Capital",,
AvidXchange,2.42,6/8/2017,United States,Charlotte,Fintech,"Temasek Holdings, Charlotte Angel Partners, TPG Growth",,
Away,1.4,5/15/2019,United States,New York,E-commerce & direct-to-consumer,"Global Founders Capital, Comcast Ventures, Forerunner Ventures",,
Axiom Space,1,2/16/2021,United States,Houston,Other,"C5 Capital, Hemisphere Ventures, The Venture Collective",,
Axonius,1.2,3/1/2021,United States,New York,Cybersecurity,"Vertex Ventures Israel, Bessemer Venture Partners, Emerge",,
Axtria,1,5/13/2021,United States,Berkeley Heights,Data management & analytics,"Helion Venture Partners, Bain Capital Tech Opportunities, Sequoia Capital India",,
Babylon Health,2,8/2/2019,United Kingdom,London,Artificial intelligence,"Kinnevik, Vostok New Ventures, Public Investment Fund of Saudi Arabia",,
Back Market,3.2,5/18/2021,France,Paris,E-commerce & direct-to-consumer,"Aglae Ventures, Eurazeo, Daphni",,
Baiwang,1.55,3/25/2019,China,Beijing,Fintech,"Guozhong Venture Capital Management, Shenzhen Capital Group, Oriental Fortune Capital",,
Banma Network Technologies,1,9/13/2018,China,Shanghai,Auto & transportation,"Yunfeng Capital, SDIC Innovation Investment Management, Shang Qi Capital",,
BeiBei,1,1/22/2015,China,Hangzhou,E-commerce & direct-to-consumer,"Banyan Capital, New Horizon Capital, IDG Capital Partners",,
Beisen,2,5/11/2021,China,Beijing,Internet software & services,"Matrix Partners China, Sequoia Capital China, Genesis Capital",,
Benchling,4,4/14/2021,United States,San Francisco,Internet software & services,"Thrive Capital, Benchmark, MenloVentures",,
BenevolentAI,1,6/2/2015,United Kingdom,London,Artificial intelligence,Woodford Investment Management,,
Better.com,6,11/10/2020,United States,New York,Fintech,"Pine Brook, American Express Ventures, Kleiner Perkins Caufield & Byers",,
BetterUp,1.73,2/25/2021,United States,San Francisco,Internet software & services,"Threshold Ventures, Lightspeed Venture Partners, Crosslink Capital",,
BGL Group,3,11/24/2017,United Kingdom,Peterborough,Fintech,CPP Investment Board,,
BigID,1.25,12/16/2020,United States,New York,Cybersecurity,"BOLDstart Ventures, SAP.iO Fund, Scale Venture Partners",,
BillDesk,1.9,11/16/2018,India,Mumbai,Fintech,"Temasek Holdings, Visa, March Capital Partners",,
Biosplice Therapeutics,12,8/6/2018,United States,San Diego,Health,"Vickers Venture Partners, IKEA GreenTech",,
Bird Rides,2.85,5/30/2018,United States,Santa Monica,Auto & transportation,"Tusk Ventures, Craft Ventures, Sequoia Capital",,
Biren Technology,1.09,8/18/2020,China,Shanghai,Hardware,"V FUND, IDG Capital, Green Pine Capital Partners",,
BitFury,1,11/6/2018,Netherlands,Amsterdam,Hardware,"Georgian Co-Investment Fund, iTech Capital, Galaxy Digital",,
Bitmain Technologies,12,7/6/2018,China,Beijing,Hardware,"Coatue Management, Sequoia Capital China, IDG Capital",,
BitPanda,1.2,3/16/2021,Austria,Vienna,Fintech,"Speedinvest, Valar Ventures, Uniqa Ventures",,
Bitso,2.2,5/5/2021,Mexico,Mexico City,Fintech,"Pantera Capital, QED Investors, Coinbase Ventures",2014,LATAM
BlaBlaCar,2,9/16/2015,France,Paris,Auto & transportation,"Accel Partners, Index Ventures, Insight Venture Partners",,
Black Unicorn Factory,6.1,5/20/2021,United States,Los Angeles,Other,Barter Ventures,,
Blockchain.com,5.2,2/17/2021,United Kingdom,London,Fintech,"Lightspeed Venture Partners, Google Ventures, Lakestar",,
BlockFi,3,3/11/2021,United States,Jersey City,Fintech,"ConsenSys Ventures, Valar Ventures, PUC",,
Bolt,4.3,5/29/2018,Estonia,Tallinn,Auto & transportation,"Didi Chuxing, Diamler, TMT Investments",,
Boom Supersonic,1,12/16/2020,United States,Englewood,Other,"WRVI Capital, Caffeinated Capital, Y Combinator",,
Bordrin Motors,1.48,6/3/2019,China,Shanghai,Auto & transportation,"China Grand Prosperity Investment, CSC Group",,
Bought By Many,2.35,6/1/2021,United Kingdom,London,Fintech,"Octopus Ventures, Munich Re Ventures, CommerzVentures",,
Bowery Farming,2.3,5/25/2021,United States,New York,Other,"Temasek, Google Ventures, General Catalyst",,
Branch,1,9/10/2018,United States,Redwood City,Mobile & telecommunications,"New Enterprise Associates, Pear, Cowboy Ventures",,
BrewDog,1.24,4/10/2017,United Kingdom,Aberdeen,Consumer & retail,"TSG Consumer Partners, Crowdcube",,
Brex,7.4,10/5/2018,United States,San Francisco,Fintech,"DST Global, Ribbit Capital, Greenoaks Capital Management",,
Bringg,1,6/16/2021,Israel,Tel Aviv,"Supply chain, logistics, & delivery","Salesforce Ventures, next47, Pereg Ventures",,
BrowserStack,4,6/16/2021,Ireland,Dublin,Internet software & services,"Accel, Insight Partners, Bond Capital",,
Bukalapak,3.5,11/16/2017,Indonesia,Jakarta,E-commerce & direct-to-consumer,"500 Startups, Batavia Incubator, Emtek Group",,
Bunq,2,6/18/2021,Netherlands,Amsterdam,Fintech,Undisclosed,,
Buzzfeed,1.7,8/18/2015,United States,New York,Internet software & services,"SV Angel, RRE Ventures, New Enterprise Associates",,
BYJU's,16.5,7/25/2017,India,Bengaluru,Edtech,"Tencent Holdings, Lightspeed India Partners, Sequoia Capital India",,
Bytedance,140,4/7/2017,China,Beijing,Artificial intelligence,"Sequoia Capital China, SIG Asia Investments, Sina Weibo, Softbank Group",,
BYTON,2.5,4/20/2018,China,Nanjing,Auto & transportation,"FAW Group, Tencent Holdings, Tus Holdings",,
C2FO,1,8/7/2019,United States,Leawood,Fintech,"Union Square Ventures, Summerhill Venture Partners, Mithril Capital Management",,
C6 Bank,5.05,12/2/2020,Brazil,Sao Paulo,Fintech,Credit Suisse,2018,LATAM
Cabify,1.4,1/22/2018,Spain,Madrid,Auto & transportation,"Seaya Ventures, Otter Rock Capital, Rakuten",,
Calendly,3,1/26/2021,United States,Atlanta,Internet software & services,"ICONIQ Capital, OpenView Venture Partners",,
Calm,2,2/6/2019,United States,San Francisco,Consumer & retail,"Insight Venture Partners, TPG Growth, Sound Ventures",,
Cambridge Mobile Telematics,1.5,12/19/2018,United States,Cambridge,Mobile & telecommunications,SoftBank Group,,
Cameo,1,3/30/2021,United States,Chicago,Internet software & services,"Lightspeed Venture Partners, Kleiner Perkins Caufield & Byers, Origin Ventures",,
Canva,15,1/8/2018,Australia,Surry Hills,Internet software & services,"Sequoia Capital China, Blackbird Ventures, Matrix Partners",,
CAOCAO,1.6,1/17/2018,China,Hangzhou,Auto & transportation,"People Electrical Appliance Group China, Zhongrong International Trust",,
Capsule,1,4/28/2021,United States,New York,Health,"Thrive Capital, Durable Capital Partners, G Squared",,
Carbon,2.4,8/20/2015,United States,Redwood City,Hardware,"Google Ventures, Sequoia Capital, Wakefield Group",,
Caris Life Sciences,7.83,5/17/2021,United States,Irving,Health,"Sixth Street Partners, OrbiMed Advisors, Highland Capital Management",,
Carro,1,6/14/2021,Singapore,,E-commerce & direct-to-consumer,"SingTel Innov8, Alpha JWC Ventures, Golden Gate Ventures",,
Cars24,1,11/24/2020,India,Gurgaon,E-commerce & direct-to-consumer,"Moore Strategic Ventures, DST Global, Sequoia Capital India",,
Carta,1.7,5/6/2019,United States,San Francisco,Fintech,"Menlo Ventures, Spark Capital, Union Square Ventures",,
Cato Networks,1,11/17/2020,Israel,Tel Aviv,Cybersecurity,"Aspect Ventures, SingTel Innov8, Greylock Partners",,
Cava Group,1.3,4/27/2021,United States,Washington,Other,"SWaN & Legend Ventures, Revolution Growth, Invus Group",,
Cazoo,2.5,6/23/2020,United Kingdom,London,E-commerce & direct-to-consumer,"dmg ventures, General Catalyst, Octopus Ventures",,
Cedar,3.2,3/9/2021,United States,New York,Fintech,"Thrive Capital, Founders Fund, Cocnord Health Partners",,
Cell C,1,8/7/2017,South Africa,Midrand,Mobile & telecommunications,"Blue Label Telecoms, Net1 UEPS Technologies",,
Celonis,11,6/26/2018,Germany,Munich,Data management & analytics,"Accel, 83North",,
Cerebral,1.23,6/10/2021,United States,San Francisco,Health,"Oak HC/FT Partners, Artis Ventures, WestCap Group",,
Cerebras Systems,1.17,11/14/2018,United States,Los Altos,Hardware,"Benchmark, Foundation Capital, Sequoia Capital",,
Cgtz,2.41,2/21/2017,China,Hangzhou,Fintech,"Shunwei Capital Partners, China Media Group, Guangzhou Huiyin Aofeng Equity Investment Fund",,
Chainalysis,4.2,11/23/2020,United States,New York,Fintech,"Addition, Benhcmark, Accel",,
Changingedu,1.5,10/30/2017,China,Shanghai,Edtech,"Trustbridge Partners, IDG Capital, Sequoia Capital China",,
ChargeBee Technologies,1.4,4/20/2021,United States,Walnut,Fintech,"Insight Partners, Tiger Global Management, Accel",,
Checkout.com,15,5/2/2019,United Kingdom,London,Fintech,"Tiger Global Management, Insight Partners, DST Global",,
Checkr,2.2,9/19/2019,United States,San Francisco,Internet software & services,"Y Combinator, Accel, T. Rowe Price",,
Chehaoduo,9,3/12/2016,China,Beijing,E-commerce & direct-to-consumer,"Sequoia Capital China, GX Capital",,
Chezhubang,1,7/10/2020,China,Beijing,E-commerce & direct-to-consumer,"JOY Capital, NIO Capital, Blueflame Capital",,
Chime,14.5,3/5/2019,United States,San Francisco,Fintech,"Forerunner Ventures, Crosslink Capital, Homebrew",,
China Cloud,1,6/11/2018,China,Wuxi,Hardware,"V Star Capital, GF Xinde Investment Management Co., Haitong Leading Capital Management",,
Chipper Cash,1.5,6/1/2021,United States,San Francisco,Fintech,"Deciens Capital, Bezos Expeditions, 500 Startups",,
Circle Internet Financial,3,5/15/2018,United States,Boston,Fintech,"General Catalyst, Digital Currency Group, Accel",,
CircleCI,1.7,5/11/2021,United States,San Francisco,Internet software & services,"Threshold Ventures, Baseline Ventures, Harrison Metal",,
Cityblock Health,1,12/10/2020,United States,Brooklyn,Health,"Thrive Capital, Maverick Ventures, Redpoint Ventures",,
Clari,1.6,3/3/2021,United States,Sunnyvale,Internet software & services,"Sequoia Capital, Bain Capital Ventures, enaya Capital",,
Claroty,1,6/17/2021,United States,New York,Cybersecurity,"Bessemer Venture Partners, MoreVC, Team8",,
ClassPass,1,1/8/2020,United States,New York,Internet software & services,"General Catalyst, L Catterton, Acequia Capital",,
Clearco,2,4/20/2021,Canada,Toronto,Fintech,"Highland Capital Partners, Oak HC/FT Partners, Emergence Capital Partners",,
Clearcover,1,4/13/2021,United States,Chicago,Fintech,"American Family Ventures, Cox Enterprises, OMERS Ventures",,
ClickUp,1,12/15/2020,United States,San Diego,Internet software & services,"Georgian Partners, Craft Ventures",,
Clio,1.6,4/27/2021,Canada,Burnaby,Internet software & services,"OMERS Private Equity, T. Rowe Price, Technology Crossover Ventures",,
Clip,2,6/10/2021,Mexico,Mexico City,Fintech,"Alta Ventures Mexico, General Atlantic, SoftBank Group",2012,LATAM
Cloudwalk,3.32,10/8/2018,China,Guangzhou,Artificial intelligence,"Oriza Holdings, Guangdong Technology Financial Group",,
Clubhouse,4,1/24/2021,United States,San Francisco,Mobile & telecommunications,"Andreessen Horowitz, TQ Ventures",,
CMR Surgical,3,9/17/2019,United Kingdom,Cambridge,Health,"Cambridge Innovation Capital, LGT Capital Partners, Escala Capital",,
Coalition,1.3,3/16/2021,United States,San Francisco,Cybersecurity,"Two Sigma Ventures, Flint Capital, Commerce Ventures",,
Cockroach Labs,2.16,1/12/2021,United States,New York,Data management & analytics,"Google Ventures, Benchmark, FirstMark Capital",,
Coda,1.4,7/8/2021,United States,Mountain View,Internet software & services,"Greylock Partners, General Catalyst, Khosla Ventures",,
Cognite,1.6,5/19/2021,Norway,Lysaker,Data management & analytics,"Technology Crossover Ventures, Accel, Aker",,
Cohesity,3.7,6/11/2018,United States,San Jose,Data management & analytics,"SoftBank Group, Sequoia Capital, Wing Venture Capital",,
Collective Health,1.5,6/17/2019,United States,San Francisco,Fintech,"New Enterprise Associates, Founders Fund, Google Ventures",,
Collibra,2.36,1/29/2019,Belgium,Brussels,Data management & analytics,"Index Ventures, Battery Ventures, ICONIQ Capital",,
Color,1.5,1/4/2021,United States,Burlingame,Health,"General Catalyst, Viking Global Investors, T. Rowe Price",,
ContentSquare,2.8,5/25/2021,France,Paris,Internet software & services,"Highland Europe, Eurazeo, Canaan Partners",,
Convoy,2.75,9/21/2018,United States,Seattle,"Supply chain, logistics, & delivery","Greylock Partners, capitalG, Y Combinator",,
Coocaa,1.45,3/16/2018,China,Shenzhen,Hardware,"Baidu, Tencent Holdings",,
Course Hero,1.1,2/12/2020,United States,Redwood City,Edtech,"NewView Capital, Maveron, Ridge Ventures",,
Coveo,1.1,11/6/2019,Canada,Quebec City,Artificial intelligence,"Fonds de Solidarite FTQ, Propulsion Ventures, BDC Venture Capital",,
CRED,2.2,4/6/2021,India,Bengaluru,Fintech,"Tiger Global Management, DST Global, Sequoia Capital India",,
Creditas,1.75,12/18/2020,Brazil,Sao Paulo,Fintech,"Kaszek Ventures, Amadeus Capital Partners, Quona Capital",2012,LATAM
Current,2.2,4/27/2021,United States,New York,Fintech,"Expa, QED Investors, Foundation Capital",,
Cybereason,1.5,6/21/2017,United States,Boston,Cybersecurity,"SoftBank Group, CRV, Spark Capital",,
Dadi Cinema,3.24,5/11/2016,China,Shenzhen,Other,Alibaba Pictures Group,,
DailyHunt,1,12/22/2020,India,Bengaluru,Internet software & services,"Falcon Edge Capital, Omidyar Network, Sequoia Capital India",,
Dapper Labs,2.6,3/30/2021,Canada,Vancouver,Fintech,"Union Square Ventures, Venrock, Andreessen Horowitz",,
Databricks,28,2/5/2019,United States,San Francisco,Data management & analytics,"Andreessen Horowitz, New Enterprise Associates, Battery Ventures",,
Dataiku,1.06,12/4/2019,United States,New York,Internet software & services,"Alven Capital, FirstMark Capital, capitalG",,
Dataminr,4.1,6/4/2018,United States,New York,Artificial intelligence,"Venrock, Institutional Venture Partners, Goldman Sachs",,
DataRobot,2.8,7/29/2019,United States,Boston,Artificial intelligence,"New Enterprise Associates, Accomplice, IA Ventures",,
Dave,1,9/30/2019,United States,Los Angeles,Fintech,"Section 32, SV Angel, Norwest Venture Partners",,
dbt Labs,1.5,6/30/2021,United States,Philadelphia,Data management & analytics,"Andreessen Horowitz, Amplify Partners, Sequoia Capital",,
Deel,1.25,4/21/2021,United States,San Francisco,Fintech,"Andreessen Horowitz, Spark Capital, Y Combinator",,
DeepBlue Technology,1.35,4/16/2018,China,Shanghai,Artificial intelligence,"DESUN Capital, Yunfeng Capital, Meridian Capital",,
Deezer,1.4,8/2/2018,France,Paris,Internet software & services,"Orange Digital Ventures, Access Industries",,
Degreed,1.4,4/13/2021,United States,Pleasanton,Edtech,"Signal Peak Ventures, Owl Ventures, Jump Capital",,
Delhivery,3,2/27/2019,India,Gurgaon,"Supply chain, logistics, & delivery","Times Internet, Nexus Venture Partners, SoftBank Group",,
Devoted Health,3.78,10/16/2018,United States,Waltham,Health,"Andreessen Horowitz, F-Prime Capital, Venrock",,
Dialpad,1.2,10/6/2020,United States,San Francisco,Internet software & services,"Andreessen Horowitz, Google Ventures, Section 32",,
Diamond Foundry,1.8,3/29/2021,United States,San Francisco,Other,"Fashion Tech Lab, Fidelity Investments, Vast Ventures",,
DianRong,1,8/2/2017,China,Shanghai,E-commerce & direct-to-consumer,"Standard Chartered, FinSight Ventures, Affirma Capital",,
Digit Insurance,3.5,1/15/2021,India,Bengaluru,Fintech,"Fairfax Financial Holdings, A91 Partners, TVS Capital",,
Discord,7,4/20/2018,United States,San Francisco,Internet software & services,"Benchmark, Greylock Partners, Tencent Holdings",,
DispatchHealth,1.7,3/3/2021,United States,Denver,Health,"Alta Partners, Questa Capital, Echo Health Venturesl",,
DJI Innovations,15,1/23/2015,China,Shenzhen,Hardware,"Accel Partners, Sequoia Capital",,
Doctolib,1.14,3/19/2019,France,Paris,Health,"BPI France, Kerala Ventures, Accel",,
Dream Games,1,6/30/2021,Turkey,Istanbul,Mobile & telecommunications,"Makers Fund, Index Ventures, Inova Ventures Participacees",,
Dream11,5,4/9/2019,India,Mumbai,Internet software & services,"Kaalari Capital, Tencent Holdings, Steadview Capital",,
Dremio,1,1/6/2021,United States,Santa Clara,Data management & analytics,"Lightspeed Venture Partners, Redpoint Ventures, Norwest Venture Partners",,
DriveNets,1,1/27/2021,Israel,Ra'anana,Internet software & services,"Bessemer Venture Partners, Pitango Venture Capital, D1 Capital Partners",,
Druva,2,6/20/2019,United States,Sunnyvale,Data management & analytics,"Nexus Venture Partners, Tenaya Capital, Sequoia Capital",,
DT Dream,1.5,6/8/2017,China,Hangzhou,Data management & analytics,"Alibaba Group, China Everbright Investment Management, Yinxinggu Capital",,
Duolingo,2.4,12/4/2019,United States,Pittsburgh,Education,"capitalG, Union Square Ventures, New Enterprise Associates",,
Dutchie,1.7,3/16/2021,United States,Bend,E-commerce & direct-to-consumer,"Casa Verde Capital, Gron Ventures, Thrity Five Ventures",,
Dxy.cn,1,4/10/2018,China,Hangzhou,Health,"Tencent Holdings, DCM Ventures",,
Earnix,2,2/21/2021,Israel,Giv'atayim,Fintech,"Jerusalem Venture Partners, Israel Growth Partners, Insight Partners",,
Easyhome,5.78,2/12/2018,China,Beijing,Consumer & retail,"Alibaba Group, Boyu Capital, Borui Capital",,
Eat Just,1.1,11/30/2017,United States,San Francisco,Consumer & retail,"Khosla Ventures, Horizons Ventures, Founders Fund",,
EBANX,1,10/16/2019,Brazil,Curitiba,Fintech,"FTV Capital, Endeavor",2011,LATAM
ECARX,1.49,10/26/2020,China,Wuhan,Auto & transportation,"Geely, SIG Asia Investments, China State Capital Venture Capital Fund",,
EcoFlow,1,6/10/2021,China,Shenzhen,Hardware,"Delian Capital, China International Capital Corporation, Sequoia Capital China",,
eDaili,1.9,2/1/2019,China,Shanghai,E-commerce & direct-to-consumer,"K2VC, Lightspeed China Partners, Sky9 Capital",,
Eightfold.ai,2.1,10/27/2020,United States,Santa Clara,Internet software & services,"Foundation Capital, Institutional Venture Partners, General Catalyst",,
Emerging Markets Property Group,1,4/28/2020,United Arab Emirates,Dubai,Other,"OLX Group, KCK Group, EXOR Seeds",,
Enflame,1.24,1/5/2021,China,Shanghai,Hardware,"Tencent Holdings, Delta Capital, Redpoint Ventures China",,
Enfusion,1.5,1/11/2021,United States,Chicago,Fintech,FTV Capital,,
ENOVATE,1.85,4/15/2019,China,Shanghai,Auto & transportation,Automobile Industry Guidance Fund,,
Epic Games,28.7,10/26/2018,United States,Cary,Other,"Tencent Holdings, KKR, Smash Ventures",,
Epidemic Sound,1.4,3/11/2021,Sweden,Stockholm,Internet software & services,"EQT Partners, Blackstone",,
EQRx,1.23,1/11/2021,United States,Cambridge,Health,"Nextech Invest, Casdin Capital, Google Ventures",,
Ethos Technologies,2,5/11/2021,United States,San Francisco,Fintech,"Sequoia Capital, Google Ventures, Accel",,
Everly Health,1.3,12/3/2020,United States,Austin,E-commerce & direct-to-consumer,"Highland Capital Partners, Next Coast Ventures, SoGal Ventures",,
Evidation Health,1,3/22/2021,United States,San Mateo,Health,"B Capital Group,, GE Ventures, McKesson Ventures",,
Exabeam,2.4,6/1/2021,United States,Foster City,Cybersecurity,"Norwest Venture Partners, Aspect Ventures, Lightspeed Venture Partners",,
Extend,1.6,5/18/2021,United States,San Francisco,Fintech,"GreatPoint Ventures, Meritech Capital Partners, PayPal Ventures",,
ezCater,1.25,4/2/2019,United States,Boston,"Supply chain, logistics, & delivery","Insight Venture Partners, ICONIQ Capital, Launchpad Venture Group",,
Fair,1.2,12/20/2018,United States,Santa Monica,Auto & transportation,"CreditEase Fintech Investment Fund, BMW i Ventures, SoftBank Group",,
Faire,7,10/30/2019,United States,San Francisco,Artificial intelligence,"Khosla Ventures, Forerunner Ventures, Sequoia Capital",,
Fanatics,12.8,6/6/2012,United States,Jacksonville,E-commerce & direct-to-consumer,"SoftBank Group, Andreessen Horowitz, Temasek Holdings",,
